{
  "schemaVersion": "1.0",
  "toolVersion": "0.1.2",
  "status": "partial",
  "project": {
    "root": ".",
    "name": "conflicted-app",
    "kind": "single-package",
    "repository": { "kind": "unknown", "evidence": [] },
    "evidence": ["ev-000001"]
  },
  "ecosystems": [
    { "name": "node", "support": "first-class", "evidence": ["ev-000001"] }
  ],
  "packageManager": {
    "name": null,
    "version": null,
    "confidence": "unknown",
    "invocationAvailable": false,
    "evidence": ["ev-000002", "ev-000003"]
  },
  "runtimes": [],
  "workspace": {
    "enabled": false,
    "manager": null,
    "declarations": [],
    "packages": [],
    "total": null,
    "returned": 0,
    "truncated": false
  },
  "commands": {
    "build": [],
    "test": [
      {
        "cwd": ".",
        "script": "test",
        "argv": null,
        "source": "package.json#/scripts/test",
        "confidence": "confirmed",
        "declaredByProject": true,
        "execution": "not_run",
        "evidence": ["ev-000004"]
      }
    ],
    "lint": [],
    "typecheck": [],
    "dev": [],
    "start": [],
    "format": []
  },
  "scripts": [
    { "cwd": ".", "names": ["test"], "evidence": ["ev-000004"] }
  ],
  "entrypoints": [],
  "configs": [],
  "instructions": [],
  "ci": [],
  "evidence": [
    { "id": "ev-000001", "kind": "manifest", "path": "package.json", "pointer": "/name" },
    { "id": "ev-000002", "kind": "file", "path": "package-lock.json" },
    { "id": "ev-000003", "kind": "file", "path": "pnpm-lock.yaml" },
    { "id": "ev-000004", "kind": "manifest", "path": "package.json", "pointer": "/scripts/test" }
  ],
  "warnings": [
    {
      "code": "PACKAGE_MANAGER_CONFLICT",
      "severity": "warning",
      "message": "Recognized lockfiles belong to multiple package-manager families; invocation is unavailable.",
      "path": ".",
      "evidence": ["ev-000002", "ev-000003"]
    }
  ],
  "coverage": {
    "status": "partial",
    "strategies": ["root-sentinels", "package-roots"],
    "budgets": {
      "workspacePackages": 100,
      "directoryDepth": 12,
      "directoryEntries": 10000,
      "metadataFiles": 1000,
      "metadataFileBytes": 262144,
      "metadataTotalBytes": 8388608,
      "outputBytes": 1048576,
      "sourceStringBytes": 4096
    },
    "usage": { "directoryEntries": 2, "metadataFiles": 1, "metadataBytes": 220 },
    "categories": {
      "repository": "complete",
      "ecosystems": "complete",
      "packageManager": "partial",
      "runtimes": "partial",
      "workspace": "not_applicable",
      "commands": "partial",
      "scripts": "partial",
      "entrypoints": "partial",
      "configs": "complete",
      "instructions": "complete",
      "ci": "complete"
    },
    "truncated": {
      "workspace": false,
      "output": false,
      "directoryEntries": false,
      "metadataFiles": false,
      "metadataBytes": false,
      "depth": false
    }
  }
}
